Term,Definition,Originator,Example Use
Blind Alabamans,"Whilst they do not actually exist, the Blind Alabamans are indicative of a new low (qv) in dismal 'world music'. Promoted by Gil (qv) as superb (qv)",Andy,Scott - do you ever listen to anything other than Uzbek throat-warblers or the Blind Alabamans ? Why not crack out the Ramones for a change ? You'll feel better for it.
Lucinda Williams,A famous showjumper who'll be forgotten in 12 months time,Not Andy,I have no problem with show jumping per se. So long as we're talking hairy sweary Harvey Smith type stuff. But Ramsey's obsession with this Lucinda Williams nonsense beggars belief.
Loveless,1. The greatest record made in the last 20 years. 2. The most over-rated record made in the last 20 years.,Andy,"In order to fully appreciate Loveless you must play it at bone-shaking volume. It's gotta hurt". "Yeah - but it's still shit".
Irony,what no-one ever gets. Sometimes intentionally.,omni,
Sting,Uberc*nt. Superlative of c*ntish,All,"I am c*ntish. You are more c*ntish. He is Sting. "O Sting, where is thy death" (Shakespeare),"
SarahCarla,Semi-mythical List love goddess from the fabled land of Leitrim. What members will see when their points are claimed from the Dead Pool spreadsheet. Brian has a temple web-site.,John B,"Well that Scarlett Johanssen's all very nice but not as good-looking as SarahCarla".
Celticfeet,"Bizarre 'handle' used by listmember Gil (qv). Presumed to be done so as to look mysterious and interesting but sadly we can all tell who it is anyway. See also 'cocopops', 'boy_mcgenius' etc. Strange","Gil, John B, Brian etc",Celticfeet2001:  You are all tossahs. (thinks: they'll never guess it's me)
OCS,Ocean Colour Scene (abbrev). Superlative of mediocre.,Trad,I am mediocre (as IoJ standards demand). You are Stereophonics. They are OCS.
East 17,A band that Brian Harvey was in.,Ramsay,I love that Brian (Ramsay)
